{
  "$schema": "../../../../packages/course-geo/acquisition/d2-discovery.schema.json",
  "schemaVersion": 1,
  "phase": "D2-authoritative-acquisition-spike",
  "groundId": "upsala",
  "groundName": "Upsala Golfklubb",
  "courseSlugs": [
    "upsala",
    "upsala-mellanbanan"
  ],
  "observedOn": "2026-08-30",
  "state": "discovery-evidence-only",
  "aoi": {
    "bboxWgs84": [
      17.452,
      59.815,
      17.54,
      59.864
    ],
    "bboxEpsg3006": [
      637307.047,
      6633352.452,
      642442.493,
      6638992.577
    ],
    "widthMetres": 5135.446,
    "heightMetres": 5640.125,
    "squareMetres": 28964557.371
  },
  "sourceContracts": {
    "terrain": {
      "provider": "Lantmäteriet",
      "product": "Markhöjdmodell Nedladdning",
      "discovery": "https://api.lantmateriet.se/stac-hojd/v1/",
      "collection": "dtm-cog",
      "dataAccess": "authenticated Basic or OAuth2 access after a free product order",
      "horizontalCrs": "EPSG:3006",
      "verticalCrs": "EPSG:5613 (RH 2000)",
      "compoundCrs": "EPSG:5845",
      "licence": "CC-BY-4.0",
      "terms": "https://www.lantmateriet.se/globalassets/geodata/geodataprodukter/anvandningsvillkor_for_vardefulla_datamangder.pdf",
      "termsVersion": "LM2025/009266 version 1.0, 2025-02-01"
    },
    "laser": {
      "provider": "Lantmäteriet",
      "product": "Laserdata Nedladdning, skog",
      "discovery": "https://api.lantmateriet.se/stac-hojd/v1/",
      "collection": "dsm-skoglig-copc",
      "dataAccess": "authenticated Basic or OAuth2 access after a free product order",
      "horizontalCrs": "EPSG:3006",
      "verticalCrs": "EPSG:5613 (RH 2000)",
      "compoundCrs": "EPSG:5845",
      "licence": "CC-BY-4.0",
      "terms": "https://www.lantmateriet.se/globalassets/geodata/geodataprodukter/anvandningsvillkor-for-laserdata-nedladdning-skog.pdf",
      "termsVersion": "LM2026/077164 version 1.0, 2026-05-20"
    },
    "orthophoto": {
      "provider": "Lantmäteriet",
      "product": "Ortofoto Nedladdning",
      "discovery": "https://api.lantmateriet.se/stac-bild/v1/",
      "collection": "selected dynamically from the newest complete campaign",
      "dataAccess": "authenticated access after a free order and legal review",
      "horizontalCrs": "EPSG:3006",
      "verticalCrs": null,
      "licence": "CC-BY-4.0 with special access/GDPR terms",
      "terms": "https://geotorget.lantmateriet.se/dokument/projects/ortofoto-nedladdning/released/2025.02/",
      "termsVersion": "current terms must be captured when access is approved"
    },
    "treeHeight": {
      "provider": "Skogsstyrelsen",
      "product": "Trädhöjd från Laserdata skog",
      "discovery": "https://geodata.skogsstyrelsen.se/arcgis/rest/services/Publikt/Tradhojd_3_2/ImageServer",
      "dataAccess": "authenticated REST/WMS account or the published FTPS distribution",
      "horizontalCrs": "EPSG:3006",
      "verticalCrs": "height-above-ground",
      "licence": "CC0-1.0 unless a product-specific exception is supplied",
      "terms": "https://www.skogsstyrelsen.se/e-tjanster-och-kartor/karttjanster/geodatatjanster/villkor/",
      "termsVersion": "official page updated 2026-05-13"
    }
  },
  "terrain": {
    "collection": "dtm-cog",
    "itemCount": 2,
    "coverage": {
      "requiredSquareMetres": 28964557.371,
      "coveredSquareMetres": 28964557.371,
      "ratio": 1,
      "complete": true
    },
    "crsValidated": true,
    "compoundCrs": "EPSG:5845",
    "horizontalCrs": "EPSG:3006",
    "verticalCrs": "EPSG:5613 (RH 2000)",
    "resolutionMetres": 1,
    "fullSourceCompressedBytes": 627241983,
    "captureRange": {
      "first": "2021-03-07T00:00:00Z",
      "last": "2025-06-15T00:00:00Z"
    },
    "items": [
      {
        "id": "663_63",
        "collection": "dtm-cog",
        "bboxWgs84": [
          17.316146395227616,
          59.78409040996446,
          17.500841280329375,
          59.87706811611447
        ],
        "projCode": "EPSG:5845",
        "projBbox": [
          630000,
          6630000,
          640000,
          6640000
        ],
        "capturedAt": "2023-04-27T00:00:00Z",
        "captureStart": "2021-03-08T00:00:00Z",
        "captureEnd": "2025-06-15T00:00:00Z",
        "modifiedAt": "2026-02-27T00:00:00Z",
        "resolutionMetres": 1,
        "horizontalUncertaintyMetres": 0.3,
        "verticalUncertaintyMetres": 0.1,
        "pointDensityPerSquareMetre": null,
        "pointCount": null,
        "spectralType": null,
        "assets": {
          "breakgeometry": {
            "href": "https://dl1.lantmateriet.se/hojd/data/grid/mhm/66_6/m663_63_brytgeometri.gpkg",
            "type": "application/geopackage+sqlite3",
            "title": "m663_63_brytgeometri.gpkg",
            "roles": [
              "data"
            ],
            "bytes": 180224,
            "stacChecksum": "1220b95c4407e0afce8640524011711cf2442348bed51b9c999616f4a5fb5995550a",
            "sha256": "b95c4407e0afce8640524011711cf2442348bed51b9c999616f4a5fb5995550a",
            "projCode": null,
            "projBbox": null,
            "projShape": null
          },
          "data": {
            "href": "https://dl1.lantmateriet.se/hojd/data/grid/mhm/66_6/m663_63.tif",
            "type": "image/tiff; application=geotiff; profile=cloud-optimized",
            "title": "m663_63.tif",
            "roles": [
              "data"
            ],
            "bytes": 312121246,
            "stacChecksum": "122095655f47fc991c4adb6a97458d3f75cf3ec2a82d85da29ee15b360afda4641a8",
            "sha256": "95655f47fc991c4adb6a97458d3f75cf3ec2a82d85da29ee15b360afda4641a8",
            "projCode": "EPSG:5845",
            "projBbox": [
              630000,
              6630000,
              640000,
              6640000
            ],
            "projShape": [
              10000,
              10000
            ]
          },
          "info": {
            "href": "https://dl1.lantmateriet.se/hojd/pub/grid/mhm/66_6/m663_63_info.json",
            "type": "application/json",
            "title": "m663_63_info.json",
            "roles": [
              "metadata"
            ],
            "bytes": 4338,
            "stacChecksum": "12200b5c86385095df00862301ca8ec1ff71ee139117f188ae0806a17d3cbf3032d6",
            "sha256": "0b5c86385095df00862301ca8ec1ff71ee139117f188ae0806a17d3cbf3032d6",
            "projCode": null,
            "projBbox": null,
            "projShape": null
          },
          "metadata": {
            "href": "https://dl1.lantmateriet.se/hojd/pub/grid/mhm/66_6/m663_63_ursprung.json",
            "type": "application/json",
            "title": "m663_63_ursprung.json",
            "roles": [
              "metadata"
            ],
            "bytes": 152734,
            "stacChecksum": "122099c9b98d4975c1df32fd5e4e5ee87ecdda67f53362189bef5ac0ab6fda1941e4",
            "sha256": "99c9b98d4975c1df32fd5e4e5ee87ecdda67f53362189bef5ac0ab6fda1941e4",
            "projCode": null,
            "projBbox": null,
            "projShape": null
          }
        }
      },
      {
        "id": "663_64",
        "collection": "dtm-cog",
        "bboxWgs84": [
          17.49412193161695,
          59.78059338110649,
          17.679252770089576,
          59.873800051468564
        ],
        "projCode": "EPSG:5845",
        "projBbox": [
          640000,
          6630000,
          650000,
          6640000
        ],
        "capturedAt": "2023-04-26T00:00:00Z",
        "captureStart": "2021-03-07T00:00:00Z",
        "captureEnd": "2025-06-14T00:00:00Z",
        "modifiedAt": "2026-02-27T00:00:00Z",
        "resolutionMetres": 1,
        "horizontalUncertaintyMetres": 0.3,
        "verticalUncertaintyMetres": 0.1,
        "pointDensityPerSquareMetre": null,
        "pointCount": null,
        "spectralType": null,
        "assets": {
          "breakgeometry": {
            "href": "https://dl1.lantmateriet.se/hojd/data/grid/mhm/66_6/m663_64_brytgeometri.gpkg",
            "type": "application/geopackage+sqlite3",
            "title": "m663_64_brytgeometri.gpkg",
            "roles": [
              "data"
            ],
            "bytes": 311296,
            "stacChecksum": "12203699df61f8f747eda55c9266ba77adf69b6da7050fb372c60c8c58a9c9d21636",
            "sha256": "3699df61f8f747eda55c9266ba77adf69b6da7050fb372c60c8c58a9c9d21636",
            "projCode": null,
            "projBbox": null,
            "projShape": null
          },
          "data": {
            "href": "https://dl1.lantmateriet.se/hojd/data/grid/mhm/66_6/m663_64.tif",
            "type": "image/tiff; application=geotiff; profile=cloud-optimized",
            "title": "m663_64.tif",
            "roles": [
              "data"
            ],
            "bytes": 315120737,
            "stacChecksum": "12208d0107f4aa85d02200ecf91547813e93499571b995a293bdbe1b80509e34541e",
            "sha256": "8d0107f4aa85d02200ecf91547813e93499571b995a293bdbe1b80509e34541e",
            "projCode": "EPSG:5845",
            "projBbox": [
              640000,
              6630000,
              650000,
              6640000
            ],
            "projShape": [
              10000,
              10000
            ]
          },
          "info": {
            "href": "https://dl1.lantmateriet.se/hojd/pub/grid/mhm/66_6/m663_64_info.json",
            "type": "application/json",
            "title": "m663_64_info.json",
            "roles": [
              "metadata"
            ],
            "bytes": 4339,
            "stacChecksum": "1220c5b9f260e55a590a737bd9b52d0cb085d28e6d93eb9af608e8c89f866bd5a30c",
            "sha256": "c5b9f260e55a590a737bd9b52d0cb085d28e6d93eb9af608e8c89f866bd5a30c",
            "projCode": null,
            "projBbox": null,
            "projShape": null
          },
          "metadata": {
            "href": "https://dl1.lantmateriet.se/hojd/pub/grid/mhm/66_6/m663_64_ursprung.json",
            "type": "application/json",